{
  "schema_version": "1.0",
  "receipt_id": "pr-example-001",
  "source_candidate": "mining/example-candidate.md",
  "evidence_packet_sha256": "aaaaaaaaaaaaaaaaaaaaaaaaaaaaaaaaaaaaaaaaaaaaaaaaaaaaaaaaaaaaaaaa",
  "blind_review_packet_sha256": "bbbbbbbbbbbbbbbbbbbbbbbbbbbbbbbbbbbbbbbbbbbbbbbbbbbbbbbbbbbbbbbb",
  "reproducer": "human:researcher-a",
  "falsifier": "human:researcher-b",
  "adjudicator": "human:maintainer",
  "selected_evidence_status": "contributor-measured, conditions as reported",
  "selected_owner": {
    "kind": "EXISTING_TRAP",
    "id": "04"
  },
  "validators_run": [
    "checks/evidence_packet_preflight.py",
    "integrity/run_checks.py",
    "checks/tests/test_check_contract.py"
  ],
  "registry_state_before": "trap_count=113",
  "registry_state_after": "trap_count=113",
  "publishing_commit": "not-published-local-only",
  "raw_artifact_refs": [
    "artifacts/render-turn3.txt"
  ],
  "waivers": [],
  "unresolved_limitations": [
    "Single stack pin only; transfer to other engines untested."
  ]
}
